{
  "$schema":"https://json-schema.org/draft/2020-12/schema",
  "$id":"https://snagline.dev/ssp/registry-v1.schema.json",
  "type":"object","additionalProperties":false,
  "required":["schema","id","emitted_at","expires_at","routing_epoch","registry_revision","author_key_id","signature_alg","body","signature"],
  "properties":{
    "schema":{"const":"ssp.registry.v1"},"id":{"$ref":"#/$defs/id"},"emitted_at":{"type":"string"},"expires_at":{"type":"string"},"routing_epoch":{"type":"integer","minimum":0,"maximum":9007199254740991},"registry_revision":{"type":"integer","minimum":0,"maximum":9007199254740991},"author_key_id":{"$ref":"#/$defs/id"},"signature_alg":{"const":"ed25519"},"signature":{"type":"string"},
    "body":{"type":"object","additionalProperties":false,"required":["revision","routing_epoch","previous_commitment","domains","principals","edges","keys"],"properties":{"revision":{"type":"integer","minimum":0},"routing_epoch":{"type":"integer","minimum":0},"previous_commitment":{"type":["string","null"],"pattern":"^sha256:[0-9a-f]{64}$","minLength":71,"maxLength":71},"domains":{"type":"array","items":{"$ref":"#/$defs/domain"}},"principals":{"type":"array","items":{"$ref":"#/$defs/principal"}},"edges":{"type":"array","items":{"$ref":"#/$defs/edge"}},"keys":{"type":"array","items":{"$ref":"#/$defs/key"}}}}
  },
  "$defs":{"id":{"type":"string","minLength":1,"maxLength":512},"ids":{"type":"array","uniqueItems":true,"items":{"$ref":"#/$defs/id"}},"domain":{"type":"object","additionalProperties":false,"required":["domain","dispatcher_principal_id","issuer_edge_ids","specialist_principal_ids","families","routing_epoch"],"properties":{"domain":{"$ref":"#/$defs/id"},"dispatcher_principal_id":{"$ref":"#/$defs/id"},"issuer_edge_ids":{"$ref":"#/$defs/ids"},"specialist_principal_ids":{"$ref":"#/$defs/ids"},"families":{"type":"array","minItems":2,"maxItems":2,"uniqueItems":true,"items":{"enum":["ssp.case.v1","ssp.advice.v1"]}},"routing_epoch":{"type":"integer","minimum":0}}},"principal":{"type":"object","additionalProperties":false,"required":["principal_id","roles","ssp_key_ids","edge_ids"],"properties":{"principal_id":{"$ref":"#/$defs/id"},"roles":{"$ref":"#/$defs/ids"},"ssp_key_ids":{"$ref":"#/$defs/ids"},"edge_ids":{"$ref":"#/$defs/ids"}}},"edge":{"type":"object","additionalProperties":false,"required":["edge_id","principal_id","generation"],"properties":{"edge_id":{"$ref":"#/$defs/id"},"principal_id":{"$ref":"#/$defs/id"},"generation":{"type":"integer","minimum":1,"maximum":9007199254740991}}},"key":{"type":"object","additionalProperties":false,"required":["key_id","public_key","principal_id","usage","not_before","expires_at"],"properties":{"key_id":{"$ref":"#/$defs/id"},"public_key":{"type":"string"},"principal_id":{"$ref":"#/$defs/id"},"usage":{"enum":["registry","edge","advice"]},"not_before":{"type":"string"},"expires_at":{"type":"string"},"revoked_at":{"type":["string","null"]}}}}
}
