{"schema":"ssp.registry.v1","id":"registry-envelope-0012","emitted_at":"2026-07-28T00:00:00Z","expires_at":"2026-08-28T00:00:00Z","routing_epoch":7,"registry_revision":12,"author_key_id":"registry-pinned-key-2026-07","signature_alg":"ed25519","body":{"revision":12,"routing_epoch":7,"previous_commitment":null,"domains":[{"domain":"runtime","dispatcher_principal_id":"dispatcher-0001","issuer_edge_ids":["edge-local-0001"],"specialist_principal_ids":["support-principal-0001"],"families":["ssp.case.v1","ssp.advice.v1"],"routing_epoch":7}],"principals":[{"principal_id":"dispatcher-0001","roles":["dispatcher"],"ssp_key_ids":["dispatcher-key-2026-07"],"edge_ids":[]},{"principal_id":"support-principal-0001","roles":["specialist"],"ssp_key_ids":[],"edge_ids":[]},{"principal_id":"edge-principal-0001","roles":["edge"],"ssp_key_ids":["edge-key-2026-07"],"edge_ids":["edge-local-0001"]},{"principal_id":"registry-authority-0001","roles":["registry-authority"],"ssp_key_ids":["registry-key-2026-07"],"edge_ids":[]}],"edges":[{"edge_id":"edge-local-0001","principal_id":"edge-principal-0001","generation":1}],"keys":[{"key_id":"dispatcher-key-2026-07","public_key":"3--GnKrYqlcDBzgdadLDZOd8FnQkLeGaZyQUnFcaKPo","principal_id":"dispatcher-0001","usage":"advice","not_before":"2026-07-01T00:00:00Z","expires_at":"2027-07-01T00:00:00Z"},{"key_id":"edge-key-2026-07","public_key":"r_PQwB4hCcnF-kC4mv4nng5rDKZA6VQhrufNnx4JHUc","principal_id":"edge-principal-0001","usage":"edge","not_before":"2026-07-01T00:00:00Z","expires_at":"2027-07-01T00:00:00Z"},{"key_id":"registry-key-2026-07","public_key":"Nga0KcS0aZ22slZvz6VK7RZVx-BRE5Vyr5Nkp0a8G6U","principal_id":"registry-authority-0001","usage":"registry","not_before":"2026-07-01T00:00:00Z","expires_at":"2027-07-01T00:00:00Z"}]},"signature":"QBqnvOI42iK-vCDbS-KZzc3-Rt7-qExw72EQ_Pz7FnBwWHago09NKjXTYfE2Nm5JnwJpj4kYe-qTKCJg23boBg"}
